courseUrl,job_name,name_company,upadte_date,rank,amount,age,level,experience,salary,headquarters,technical_requirements
https://sieuthivieclam.vn/viec-lam/nhan-vien-ky-thuat-CV2024-26992.html,NHÂN VIÊN KỸ THUẬT(Mã:CV2024-26992),CÔNG TY TNHH THIẾT BỊ VĂN PHÒNG GIA THỊNH,Ngày cập nhật: 06/08/2024,Nhân viên,1 (1 nam),Tuổi từ 25 đến 35,Trung cấp,Không yêu cầu,14.000.000VNĐ,Quận Gò Vấp,"['\n - Số lượng: 01 (Nam)', '\n - Tốt nghiệp Trung cấp, Cao đẳng ngành kỹ thuật, cơ khí, cơ-điện tử hoặc chuyên ngành phần cứng máy tính.', '\n - Tuổi từ 25 đến 35, sức khỏe tốt, có tinh thần trách nhiệm, muốn có công việc ổn định lâu dài.']"
https://sieuthivieclam.vn/viec-lam/chuyen-vien-kinh-doanh-CV2024-26993.html,CHUYÊN VIÊN KINH DOANH(Mã:CV2024-26993),TỔNG CÔNG TY CỔ PHẦN NOVA SERVICE,Ngày cập nhật: 14/08/2024,Nhân viên,10,0,Cao đẳng,Không yêu cầu,7.500.000VNĐ,Quận 1,['\n - Thời gian làm việc: Giờ hành chánh']
https://sieuthivieclam.vn/viec-lam/nhan-vien-ky-thuat-CV2024-26998.html,NHÂN VIÊN KỸ THUẬT(Mã:CV2024-26998),CÔNG TY TNHH SƠN HÀ CT,Ngày cập nhật: 16/08/2024,Nhân viên,1 (1 nam),25-45,Cao đẳng,2,Thoả thuận,Quận Gò Vấp,"['\n ', '\n ', '\n ', '\n ', '\n ', '\n ', '\n ']"
https://sieuthivieclam.vn/viec-lam/tap-vu-CV2024-26999.html,PHỤ QUÁN CƠM(Mã:CV2024-26999),QUÁN CƠM ANH VŨ,Ngày cập nhật: 26/08/2024,Nhân viên,1 (1 nữ),38-45,Lao động phổ thông,Không yêu cầu,250.000VNĐ,Quận 1,"['\n Tác phong gọn gàng', '\n Phụ bán giờ trưa', '\n Thời gian: 6h sáng- 4 giờ chiều', '\n Làm từ thứ 2- thứ 6', '\n Thứ 7, Chủ Nhật nghỉ']"
https://sieuthivieclam.vn/viec-lam/phuc-vu-quan-bida-CV2024-27002.html,PHỤC VỤ QUÁN BIDA(Mã:CV2024-27002),KHÁNH BI CLUB,Ngày cập nhật: 26/08/2024,Nhân viên,4 (2 nam - 2 nữ),18-25,Lao động phổ thông,Không yêu cầu,Thoả thuận,Quận 6,"['\n 01 Đơn xin việc có dán ảnh', '\n 02 Bản sơ yếu lý lịch có công chứng xác nhận của UBND phường/xã', '\n Bản sao hộ khẩu, CMND có công chứng của UBND phường/xã xác nhận sao y bản chính', '\n Bản sao các văn bằng, chứng chỉ nghề liên quan có công chứng của UBND phường/xã xác nhận sao y bản chính', '\n 02 Tấm hình mới nhất khổ 3x4', '\n (Tất cả giấy tờ trên có thời hạn không quá 6 tháng kể từ ngày công chứng)']"
https://sieuthivieclam.vn/viec-lam/nhan-vien-hanh-chanh-CV2024-27003.html,NHÂN VIÊN HÀNH CHÁNH(Mã:CV2024-27003),CÔNG TY XUẤT NHẬP KHẨU THUỐC LÁ,Ngày cập nhật: 26/08/2024,Nhân viên,1 (1 nam),trên 20,Trung học phổ thông,Không yêu cầu,Thoả thuận,Quận 3,"['\n Thời gian: hành chánh', '\n Phỏng vấn trao đổi cụ thể', '\n \xa0']"
https://sieuthivieclam.vn/viec-lam/ke-toan-vien-CV2024-27004.html,KẾ TOÁN VIÊN(Mã:CV2024-27004),CÔNG TY TNHH XUẤT NHẬP KHẨU TÍN VĨ,Ngày cập nhật: 30/08/2024,Nhân viên,2 (2 nữ),Dưới 40 tuổi,Trung cấp,Không yêu cầu,10.000.000VNĐ,Quận 4,"['\n - Làm việc cho công ty chuyên về dịch vụ xuất nhập khẩu', '\n - Thời gian làm việc: giờ hành chánh từ Thứ 2 đến sáng Thứ 7', '\n ', '\n ', '\n ', '\n ']"
https://sieuthivieclam.vn/viec-lam/nhan-vien-kinh-doanh-CV2024-26994.html,GIÁM ĐỐC/ TRƯỞNG PHÒNG KINH DOANH/ TƯ VẤN BẢO HIỂM(Mã:CV2024-26994),BẢO HIỂM CÔNG NGHỆ FWD,Ngày cập nhật: 10/09/2024,Nhân viên,20,0,Trung học phổ thông,Không yêu cầu,Thoả thuận,Quận 3,"['\n • Có sự yêu thích với kinh doanh, chưa có kinh nghiệm sẽ được đào tạo', '\n • Ưu tiên có kinh nghiệm làm việc trong lĩnh vực ngân hàng, tài chính, bảo hiểm, sales, tư vấn, bán hàng, chăm sóc khách hàng, là một lợi thế', '\n • Có khả năng thực hiện các kế hoạch kinh doanh', '\n \xa0']"
https://sieuthivieclam.vn/viec-lam/nhan-vien-thu-mua-va-phat-trien-san-pham-CV2024-27006.html,NHÂN VIÊN THU MUA VÀ PHÁT TRIỂN SẢN PHẨM(Mã:CV2024-27006),GOLD FRUIT SÀI GÒN,Ngày cập nhật: 10/09/2024,Nhân viên,2,0,Cao đẳng,1,8.000.000VNĐ,Quận Thủ Đức,"['\n - Làm việc cho hệ thống cửa hàng kinh doanh trái cây', '\n - Nắm bắt nhu cầu và thực hiện mua hàng, kiểm soát chất lượng hàng theo đúng quy trình, thủ tục mua hàng, bao gồm hàng trong nước và nhập khẩu.', '\n - Thực hiện theo đúng hướng dẫn, quy trình phát triển sản phẩm mới', '\n - Chi tiết công việc được trao đổi chi tiết khi phỏng vấn.', '\n - Thời gian làm việc: 08:00 - 17:00, từ thứ 2 đến thứ 7.']"
https://sieuthivieclam.vn/viec-lam/le-tan--kinh-doanh-CV2024-27008.html,LỄ TÂN / KINH DOANH(Mã:CV2024-27008),CÔNG TY TNHH MTV TM DV MỸ DI (CALLA SPA),Ngày cập nhật: 12/09/2024,Nhân viên,5,Dưới 30 tuổi,Lao động phổ thông,Không yêu cầu,7.000.000VNĐ,Quận Phú nhuận,"['\n - Làm việc cho Spa làm đẹp, chăm sóc da', '\n - Thời gian làm việc:\xa008g30 – 19g30 (Có nghỉ trưa giữa giờ)', '\n ', '\n - 03 Nữ, dưới 30 tuổi', '\n - Mức lương: Khởi điểm 7.000.000 đ/tháng + Thưởng', '\n - Được thưởng hoa hồng cao 2% - 4% nếu tư vấn thành công gói sản phẩm', '\n - Công ty hỗ trợ chổ ở cho ứng viên cần', '\n ', '\n - 02 Nữ, dưới 30 tuổi', '\n - Mức lương: Cơ bản 8.000.000 đ/tháng + hoa hồng 2% - 4%', '\n (Đảm bảo tổng thu nhập từ 20.000.000 – 30.000.000 đ/tháng)', '\n - Công ty hỗ trợ chổ ở cho ứng viên cần']"
https://sieuthivieclam.vn/viec-lam/nhan-vien-kinh-doanh-CV2024-27010.html,NHÂN VIÊN KINH DOANH(Mã:CV2024-27010),CÔNG TY TNHH ALPHA VIỆT NAM,Ngày cập nhật: 13/09/2024,Nhân viên,2 (1 nam - 1 nữ),25-45,Trung học phổ thông,Không yêu cầu,Thoả thuận,Quận Thủ Đức,"['\n - Tiếng Nhật N 2', '\n - Tuổi: 25-40', '\n - Thời gian: hành chánh', '\n \xa0']"
https://sieuthivieclam.vn/viec-lam/nhan-vien-phuc-vu-bao-an-o-CV2024-27013.html,NHÂN VIÊN PHỤC VỤ (BAO ĂN Ở)(Mã:CV2024-27013),QUÁN HỦ TIẾU MỰC ÔNG GIÀ CHÍNH GỐC,Ngày cập nhật: 16/09/2024,Nhân viên,2 (2 nam),0,Lao động phổ thông,Không yêu cầu,Thoả thuận,Quận 1,['\n - Thời gian làm việc: 6g00 – 21g00 (Nghỉ trưa 2 tiếng)']
https://sieuthivieclam.vn/viec-lam/nhan-vien-van-phong-CV2024-27014.html,NHÂN VIÊN VĂN PHÒNG(Mã:CV2024-27014),CÔNG TY TNHH SX THỰC PHẨM VIỆT NHI,Ngày cập nhật: 18/09/2024,Nhân viên,1 (1 nữ),20 - 35,Trung cấp,Không yêu cầu,8.000.000VNĐ,Quận 6,"['\n -\xa0 Nhận đơn hàng và nhập số liệu vào hệ thống', '\n -\xa0 Thống kê số lượng để đặt hàng', '\n -\xa0 Đối chiếu công nợ với khách hàng/nhà cung cấp', '\n -\xa0 Làm sổ sách và các chứng từ mua bán hàng', '\n -\xa0 Phối hợp với bộ phận có liên quan để xử lý đơn hàng, giải quyết các sự cố phát\xa0sinh liên quan đến khách hàng.']"
https://sieuthivieclam.vn/viec-lam/nhan-vien-sale-thuc-tap-sinh-co-luong-cung-CV2024-27017.html,NHÂN VIÊN SALE/ THỰC TẬP SINH CÓ LƯƠNG CỨNG(Mã:CV2024-27017),CTY CP ĐẦU TƯ VÀ PHÁT TRIỂN BẤT ĐỘNG SẢN PHƯƠNG ĐÔNG,Ngày cập nhật: 20/09/2024,Nhân viên,60,24,Cao đẳng,Không yêu cầu,8.000.000VNĐ,Quận 2,"['\n ✅Nhân viên kinh doanh bất động sản:', '\n - Có lương cứng, trao đổi cụ thể khi phỏng vấn', '\n ✅Thực tập sinh kinh doanh:', '\n - Có hỗ trợ lương cứng và dấu mộc', '\n - Trao đổi khi phỏng vấn.', '\n \xa0']"
https://sieuthivieclam.vn/viec-lam/nhan-vien-ban-hang-CV2024-27019.html,NHÂN VIÊN BÁN HÀNG(Mã:CV2024-27019),SHOP PHỤ KIỆN THỜI TRANG,Ngày cập nhật: 25/09/2024,Nhân viên,2 (2 nữ),Dưới 35 tuổi,Lao động phổ thông,Không yêu cầu,6.000.000VNĐ,Quận 1,"['\n - Số lượng: 02 Nữ, dưới 35 tuổi', '\n - Biết Anh văn giao tiếp cơ bản', '\n - Siêng năng, chịu khó, lịch sự, vui vẻ']"
https://sieuthivieclam.vn/viec-lam/dau-bep--phu-bep--phuc-vu-CV2024-27020.html,ĐẦU BẾP / PHỤ BẾP / PHỤC VỤ(Mã:CV2024-27020),QUÁN ĂN TÀI KÝ,Ngày cập nhật: 26/09/2024,Nhân viên,6 (3 nam - 3 nữ),0,Lao động phổ thông,Không yêu cầu,Thoả thuận,Quận Bình Thạnh,"['\n - Nhanh nhẹn, chịu khó']"
https://sieuthivieclam.vn/viec-lam/nhan-vien-kinh-doanh-CV2024-27022.html,NHÂN VIÊN KINH DOANH(Mã:CV2024-27022),CÔNG TY TNHH TM DV TÂN PHONG VĨNH,Ngày cập nhật: 02/10/2024,Nhân viên,5,Dưới 40 tuổi,Lao động phổ thông,1,8.000.000VNĐ,Quận Tân Phú,"['\n - Làm việc cho công ty Kinh doanh Đèn LED, đèn quảng cáo, bán hàng online và offline', '\n - Thời gian làm việc: Giờ hành chánh, T2 – T7', '\n ', '\n ', '\n ']"
https://sieuthivieclam.vn/viec-lam/ban-hang-CV2024-27023.html,BÁN HÀNG(Mã:CV2024-27023),SHOP VƯỜN RAU AN TOÀN 49,Ngày cập nhật: 03/10/2024,Nhân viên,5,0,Lao động phổ thông,Không yêu cầu,Thoả thuận,"Quận Phú nhuận, Quận Tân Bình","['\n - Mô tả công việc: Tư vấn bán hàng, vệ sinh cửa hàng, tính tiền cho khách. Kiểm soát hạn sử dụng và chất lượng hàng hóa yêu cầu đúng tiêu chuẩn. Trưng bày và sơ chế thực phẩm. Kiểm kê tồn kho định kỳ.', '\n - Thời gian làm việc: Theo ca', '\n • Ca 1: 04h00 – 13g00', '\n Mức lương: 250.000 đ/ngày', '\n • Ca 1: 05h00 - 13h00', '\n Mức lương: 6.000.000 đ/tháng , phụ cấp cơm 500k', '\n • Ca 2: 13h00 - 21h00', '\n Mức lương: 6.000.000 đ/tháng , phụ cấp cơm 500k', '\n ', '\n ', '\n ', '\n ', '\n ', '\n ']"
https://sieuthivieclam.vn/viec-lam/lao-dong-pho-thong-nhan-vien-ho-so-noi-nghiep-giam-sat-dien-nuoc-cua-cong-trinh-cay-xanh-tai-tphcm-CV2024-27021.html,NHÂN VIÊN HỒ SƠ NỘI NGHIỆP - GIÁM SÁT ĐIỆN NƯỚC CỦA CÔNG TRÌNH CÂY XANH TẠI TP.HCM - LAO ĐỘNG PHỔ THÔNG(Mã:CV2024-27021),CÔNG TY TNHH QUANG CẢNH XANH,Ngày cập nhật: 01/10/2024,Nhân viên,20,20-55,Lao động phổ thông,Không yêu cầu,15.000.000VNĐ,"Quận 1, Quận Bình Tân, Quận Gò Vấp","['\n ', '\n ', '\n ', '\n ', '\n ', '\n ', '\n ', '\n ', '\n ', '\n ']"
https://sieuthivieclam.vn/viec-lam/nhan-vien-kinh-doanh-lao-dong-pho-thong-CV2024-27026.html,NHÂN VIÊN KINH DOANH - LAO ĐỘNG PHỔ THÔNG(Mã:CV2024-27026),HỘ KINH DOANH SONG ANH WEDDING,Ngày cập nhật: 10/10/2024,Nhân viên,3,18-32,Lao động phổ thông,Không yêu cầu,20.000.000VNĐ,Quận Gò Vấp,"['\n ', '\n ', '\n ', '\n ', '\n ', '\n ', '\n ', '\n ', '\n ', '\n ', '\n ', '\n ', '\n ', '\n ', '\n ', '\n ', '\n ', '\n ', '\n ', '\n ', '\n ', '\n ', '\n ', '\n ', '\n ', '\n ']"
