name_company,upadte_date,rank,age,level,experience,salary,Tên công việc,Mã công việc
CÔNG TY TNHH SHOPEE EXPRESS,29/12/2021,Nhân viên,,Không yêu cầu,Không yeu cau,Quận 1,SHOPEE - ĐIỀU PHỐ HÀNG HÓA,CV2021-26107
CÔNG TY TNHH SHOPEE EXPRESS,29/12/2021,Nhân viên,,Không yêu cầu,Không yeu cau,Quận 1,SHOPEE - GIAO HÀNG,CV2021-26108
TIỆM RỬA XE BIBO,30/12/2021,Nhân viên,,Không yêu cầu,Không yeu cau,Huyện Nhà Bè,TUYỂN LĐPT RỬA XE ( BAO ĂN Ở),CV2021-26111
NHÀ HÀNG FUSION XP INFINITY,10/01/2022,Nhân viên,,Không yêu cầu,Không yeu cau,Quận 2,TẠP VỤ / BẢO VỆ NHÀ HÀNG,CV2022-26118
PHÒNG ĐẠO TẠO - TRUNG TÂM DỊCH VỤ VIỆC LÀM THANH NIÊN TP. HCM,10/01/2022,Nhân viên,,Không yêu cầu,Không yeu cau,Quận 1,NHÂN VIÊN GIÁO VỤ,CV2022-26119
TRƯỜNG ĐOÀN LÝ TỰ TRỌNG,10/01/2022,Nhân viên,,Không yêu cầu,Không yeu cau,Quận Thủ Đức,HÀNH CHÁNH VĂN PHÒNG / GIÁO VIÊN,CV2022-26120
HỆ THỐNG CHUỖI NHÀ HÀNG PHỔ NGƯ,12/01/2022,Nhân viên,,Không yêu cầu,Không yeu cau,"Quận 1, Quận 3, Quận Bình Thạnh",NHÂN VIÊN PHỤC VỤ / PHỤ BẾP,CV2022-26121
HỦ TIẾU NAM VANG HÒA THUẬN,21/01/2022,Nhân viên,,Không yêu cầu,Không yeu cau,Quận 11,BÁN QUÁN ĂN (THỜI VỤ TẾT),CV2022-26127
KHÁCH SẠN VŨ GIA,08/02/2022,Nhân viên,,Không yêu cầu,Không yeu cau,Quận 1,LỄ TÂN KHÁCH SẠN,CV2022-26129
CÔNG TY TNHH SẢN XUẤT THƯƠNG MẠI DƯƠNG THÀNH,11/02/2022,Nhân viên,,Không yêu cầu,Không yeu cau,Quận Tân Phú,"GIÁO VIÊN (ĐỒ HỌA, TRANG ĐIỂM, LÀM MÓNG)",CV2022-26137
CÔNG TY TNHH THỊNH PHÁT,11/02/2022,Nhân viên,,Không yêu cầu,Không yeu cau,Quận 6,NHÂN VIÊN GIAO HÀNG ( GIAO GAS) ( Bao ăn ở),CV2022-26138
CÔNG TY TNHH TOÀN THẮNG,11/02/2022,Nhân viên,,Không yêu cầu,Không yeu cau,"Quận 1, Quận Bình Tân, Quận Bình Thạnh",NHÂN VIÊN ĐIỀU HÀNH/BÁN VÉ/KIỂM KHÁCH,CV2022-26139
KHO BUÔN TỔNG ĐỒ GIA DỤNG MIỀN NAM,14/02/2022,Nhân viên,,Không yêu cầu,Không yeu cau,Quận Thủ Đức,NHÂN VIÊN BÁN HÀNG + NHÂN VIÊN KẾ TOÁN,CV2022-26143
CÔNG TY TNHH MTV THU ÂM NGUYỄN BÁU,15/02/2022,Nhân viên,,Không yêu cầu,Không yeu cau,Quận 3,KỸ THUẬT PHÒNG THU / LỄ TÂN,CV2022-26146
SHOP GIẦY HẢI ĐĂNG ( bao ăn ở ),16/02/2022,Nhân viên,,Không yêu cầu,Không yeu cau,Quận 3,"NHÂN VIÊN BÁN HÀNG, GIAO NHẬN, LĐPT ( bao ăn ở)",CV2022-26147
CÔNG TY TNHH YURICO,17/02/2022,Nhân viên,,2,Không yeu cau,Quận Phú nhuận,KỸ THUẬT XÂY DỰNG,CV2022-26149
TRUNG TÂM DỊCH VỤ THỂ DỤC THỂ THAO,17/02/2022,Nhân viên,,Không yêu cầu,Không yeu cau,Quận 1,DỊCH VỤ SỰ KIỆN / LỄ TÂN,CV2022-26150
TƯ NHÂN - ANH VĂN QUYỀN,22/02/2022,Nhân viên,,Không yêu cầu,Không yeu cau,Quận Tân Phú,GIÚP VIỆC NHÀ (BAO ĂN Ở),CV2022-26159
BÁNH MÌ HIẾU KHÁCH,18/02/2022,Nhân viên,,Không yêu cầu,Không yeu cau,Quận Tân Bình,PHỤC VỤ,CV2022-26151
CỬA HÀNG TIỆN ÍCH NHẬT BẢN TOKUTOKUYA,24/02/2022,Nhân viên,,Không yêu cầu,Không yeu cau,Quận 3,BÁN HÀNG / THU NGÂN / GIAO HÀNG / KHO HÀNG,CV2022-26164
CÔNG TY TNHH RỪNG BIỂN,24/02/2022,Nhân viên,,Không yêu cầu,Không yeu cau,Quận 7,LAO ĐỘNG PHỔ THÔNG,CV2022-26165
PHI LONG COFFEE,28/02/2022,Nhân viên,,Không yêu cầu,Không yeu cau,Quận 7,"NHÂN VIÊN PHỤC VỤ, PHA CHẾ, BÁN HÀNG ( BAO Ở)",CV2022-26167
Công ty Cp TM Ck Tân Thanh,28/02/2022,Nhân viên,,1,Không yeu cau,Quận Thủ Đức,NHÂN VIÊN BẢO VỆ ( NỘI BỘ),CV2022-26168
CTY TNHH LỰC HỒNG,01/03/2022,Nhân viên,,Không yêu cầu,Không yeu cau,Quận 12,NV Văn Phòng/ Nữ Kế Toán Nội Bộ/ Nam LDPT,CV2022-26171
CÔNG TY LUẬT TNHH NGƯỜI ĐỒNG HÀNH,01/03/2022,Nhân viên,,Không yêu cầu,Không yeu cau,Quận 7,NHÂN VIÊN NHẮC HẠN THANH TOÁN QUA ĐIỆN THOẠI CHO CÁC NGÂN HÀNG,CV2022-26172
VIETNAM AIRLINES,02/03/2022,Nhân viên,,Không yêu cầu,Không yeu cau,Quận Tân Bình,NHÂN VIÊN KIỂM SOÁT TẢI/ SỬA CHỮA/ PHỤC VỤ HÀNH KHÁCH/ ĐIỀU PHỐI/ VẬN HÀNH THIẾT BỊ MẶT ĐẤT,CV2022-26174
CÔNG TY CỔ PHẦN LINA VŨ,02/03/2022,Nhân viên,,Không yêu cầu,Không yeu cau,Quận 10,NHÂN VIÊN HỌC VIỆC MAY/ HỌC VIỆC CẮT/ ĐÍNH KẾT,CV2022-26176
CÔNG TY TNHH SX TM THUẬN HƯNG,02/03/2022,Nhân viên,,Không yêu cầu,Không yeu cau,Quận 12,LAO ĐỘNG PHỔ THÔNG/ NHÂN VIÊN GIAO HÀNG/ NHÂN VIÊN PHA MÀU,CV2022-26177
CÔNG TY  KẸP TÓC NAM PHƯƠNG,02/03/2022,Nhân viên,,Không yêu cầu,Không yeu cau,Quận 1,ĐÓNG GÓI SẢN PHẨM/TRA GẮN LÒ XO VÀO GẮP TÓC,CV2022-26178
CÔNG TY TNHH TM-DV-KT ĐIỆN HUỲNH LAI,02/03/2022,Nhân viên,,1,Không yeu cau,Quận 1,NHÂN VIÊN KINH DOANH/NHÂN VIÊN PHÒNG DỰ ÁN,CV2022-26179
CÔNG TY TNHH ASUZAC ACM,03/03/2022,Nhân viên,,Không yêu cầu,Không yeu cau,H.Thuận An,Nhân Viên LẬP TRÌNH MASTERCAM / THIẾT KẾ / KỸ THUẬT SẢN XUẤT / CÔNG NHÂN / IOT,CV2022-26180
CÔNG TY TNHH THIÊN PHÚC,03/03/2022,Nhân viên,,Không yêu cầu,Không yeu cau,Quận 3,NHÂN VIÊN KINH DOANH,CV2022-26182
CÔNG TY TNHH THƯƠNG MẠI DƯỢC PHẨM THIÊN THUỶ,03/03/2022,Nhân viên,,Không yêu cầu,Không yeu cau,Quận Gò Vấp,LAO ĐỘNG PHỔ THÔNG ĐÓNG GÓI HÀNG HÓA,CV2022-26181
MOE JP,09/03/2022,Nhân viên,,Không yêu cầu,Không yeu cau,Quận 1,NHÂN VIÊN QUẢN LÝ + PHỤC VỤ,CV2022-26185
CÔNG TY TNHH THƯƠNG MẠI HÙNG PHÁT,09/03/2022,Nhân viên,,1,Không yeu cau,Quận 1,NHÂN VIÊN KẾ TOÁN,CV2022-26188
Công ty Cổ Phần Dệt May Gia Định,09/03/2022,Nhân viên,,Không yêu cầu,Không yeu cau,"Quận Bình Thạnh, Quận Tân Phú",CÔNG NHÂN MAY,CV2022-26189
NHÀ HÀNG BAR HANGOVER,09/03/2022,Nhân viên,,Không yêu cầu,Không yeu cau,Quận 1,PHỤC VỤ,CV2022-26190
CÔNG TY TNHH MỘT THÀNH VIÊN THƯƠNG MẠI MF,11/03/2022,Nhân viên,,Không yêu cầu,Không yeu cau,Quận 3,NHÂN VIÊN BẾP/BẢO VỆ,CV2022-26161
CÔNG TY TNHH MỘT THÀNH VIÊN THƯƠNG MẠI MF,11/03/2022,Nhân viên,,Không yêu cầu,Không yeu cau,Quận 3,NHÂN VIÊN BẾP/BẢO VỆ,CV2022-26191
CÔNG TY CP TƯ VẤN THIẾT KẾ KIỂM ĐỊNH XÂY DỰNG TOÀN CẦU,18/03/2022,Nhân viên,,Không yêu cầu,Không yeu cau,Quận 1,KIỂM ĐỊNH CHẤT LƯỢNG CÔNG TRÌNH XÂY DỰNG,CV2022-26195
CÔNG TY  KẸP TÓC NAM PHƯƠNG,17/03/2022,Nhân viên,,Không yêu cầu,Không yeu cau,Quận 1,NHÂN VIÊN GIAO HÀNG,CV2022-26201
CÔNG TY TNHH TM XÂY DỰNG MAI HÒA LỘC,21/03/2022,Nhân viên,,Không yêu cầu,Không yeu cau,Quận Tân Phú,KỸ SƯ XÂY DỰNG/CÔNG TRÌNH/KẾ TOÁN TỔNG HỢP,CV2022-26203
CÔNG TY TNHH LIÊN DOANH HOA VIỆT,21/03/2022,Nhân viên,,Không yêu cầu,Không yeu cau,Quận 9,PHỤC VỤ/ BẾP /BẢO TRÌ / CÔNG NHÂN CHĂM SÓC CỎ,CV2022-26204
CÔNG TY CỔ PHẦN POWERBOWL,22/03/2022,Nhân viên,,Không yêu cầu,Không yeu cau,Quận Tân Phú,NHÂN VIÊN KĨ THUẬT ĐIỆN,CV2022-26205
CÔNG TY TNHH QUẢNG CÁO VIETSOLUTION,23/03/2022,Nhân viên,,Không yêu cầu,Không yeu cau,Quận Bình Thạnh,NHÂN VIÊN THIẾT KẾ,CV2022-26206
CÔNG TY TNHH NGUYÊN PHỤ LIỆU TÂN ĐỨC HẢI,23/03/2022,Nhân viên,,Không yêu cầu,Không yeu cau,Quận 12,LAO ĐỘNG PHỔ THÔNG / VẬN HÀNH MÁY (HỌC NGHỀ) / KẾ TOÁN / TIẾP THỊ,CV2022-26186
CÔNG TY CP THỰC PHẨM CJ CẦU TRE,24/03/2022,Nhân viên,,Không yêu cầu,Không yeu cau,Quận Tân Phú,*LAO ĐỘNG PHỔ THÔNG ( CHẾ BIẾN THỰC PHẨM )*,CV2021-25966
CÔNG TY CỔ PHẦN KOTINOCHI,25/03/2022,Nhân viên,,Không yêu cầu,Không yeu cau,Quận 10,SALE THỊ TRƯỜNG / LEADER SALE,CV2022-26208
CÔNG TY TNHH THƯƠNG MẠI- DỊCH VỤ XUẤT NHẬP KHẨU TẤT HỮU HƯNG,26/03/2022,Nhân viên,,Không yêu cầu,Không yeu cau,Quận Gò Vấp,NHÂN VIÊN GIAO NHẬN XUẤT NHẬP KHẨU,CV2020-25578
VIVI NAIL,28/03/2022,Nhân viên,,Không yêu cầu,Không yeu cau,Quận 1,THỢ LÀM NAIL VÀ GỘI ĐẦU,CV2022-26210
CÔNG TY  TNHH ĐẦU TƯ VÀ PHÁT TRIỂN THƯƠNG MẠI CATHAY,28/03/2022,Nhân viên,,1,Không yeu cau,Quận 1,NHÂN VIÊN QUẢN LÝ BÁN HÀNG + NHÂN VIÊN KINH DOANH,CV2022-26184
CÔNG TY TNHH TM HẢI SẢN GIA HUY,29/03/2022,Nhân viên,,Không yêu cầu,Không yeu cau,"Quận 1, Quận 9, Quận Tân Bình",Nhân viên bán hàng,CV2022-26200
CÔNG TY  KẸP TÓC NAM PHƯƠNG,31/03/2022,Nhân viên,,Không yêu cầu,Không yeu cau,Quận 1,ĐÓNG GÓI SẢN PHẨM/TRA GẮN LÒ XO VÀO GẮP TÓC,CV2022-26212
CÀ PHÊ ÔNG BẦU,31/03/2022,Nhân viên,,Không yêu cầu,Không yeu cau,Quận 10,NHÂN VIÊN PHỤC VỤ,CV2022-26213
HỢP TÁC XÃ MẬT ONG PHƯƠNG DI IA GRAI,01/04/2022,Nhân viên,,Không yêu cầu,Không yeu cau,Quận Tân Bình,NHÂN VIÊN KINH DOANH,CV2022-26214
CÔNG TY TNHH MANPOWER VIỆT NAM,04/04/2022,Nhân viên,,Không yêu cầu,Không yeu cau,Huyện Củ Chi,NHÂN VIÊN KHO,CV2022-26216
CÔNG TY TNHH MTV-SX-TM VÀ DV NGỌC HOÀNG,05/04/2022,Nhân viên,,Không yêu cầu,Không yeu cau,Quận Gò Vấp,KẾ TOÁN,CV2021-25984
CÔNG TY TNHH THƯƠNG MẠI DỊCH VỤ CÔNG NGHỆ PHÚC DUY KHANG,05/04/2022,Nhân viên,,Không yêu cầu,Không yeu cau,Quận Tân Phú,KỸ THUẬT ĐIỆN TỬ / ĐIỆN LẠNH / THỢ PHỤ,CV2022-26217
CÔNG TY CỔ PHẦN VẬT TƯ TRANG THIẾT BỊ Y TẾ BÌNH AN,05/04/2022,Nhân viên,,Không yêu cầu,Không yeu cau,Quận 10,KẾ TOÁN / KINH DOANH / KỸ THUẬT VIÊN,CV2022-26218
NHÀ XUẤT BẢN CHÍNH TRỊ QUỐC GIA SỰ THẬT CHI NHÁNH TP. HỒ CHÍ MINH,12/04/2022,Nhân viên,,Không yêu cầu,Không yeu cau,Quận 3,THU NGÂN/ BÁN HÀNG,CV2022-26223
CƠ SỞ SX GHẾ NỆM NAM VINH,12/04/2022,Nhân viên,,Không yêu cầu,Không yeu cau,Quận Bình Tân,"NHÂN VIÊN TÀI XẾ + THỢ ( GHẾ NỆM, CẮT VẢI, MAY) ( BAO ĂN Ở )",CV2022-26224
CÔNG TY TNHH HƯNG THUẬN PHÁT,12/04/2022,Nhân viên,,Không yêu cầu,Không yeu cau,Quận Tân Phú,BÁN HÀNG THỊ TRƯỜNG / BÁN HÀNG ONLINE,CV2022-26211
TƯ NHÂN - CHỊ NGỌC HƯƠNG,16/04/2022,Nhân viên,,Không yêu cầu,Không yeu cau,Quận Bình Thạnh,PHỤ VIỆC THEO GIỜ,CV2022-26226
THẨM MỸ VIỆN JARIM,19/04/2022,Nhân viên,,Không yêu cầu,Không yeu cau,Quận 3,CHĂM SÓC KHÁCH HÀNG/TƯ VẤN VIÊN,CV2022-26231
CÔNG TY TNHH TM DV NGÔI SAO SÁNG,20/04/2022,Nhân viên,,Không yêu cầu,Không yeu cau,Quận 10,KẾ TOÁN VIÊN,CV2022-26232
Công ty Cổ Phần Tập Đoàn Đức Tường,21/04/2022,Nhân viên,,1,Không yeu cau,Quận 7,KẾ TOÁN TỔNG HỢP/ KẾ TOÁN THUẾ,CV2022-26233
HỆ THỐNG GIÁO DỤC ATY,21/04/2022,Nhân viên,,Không yêu cầu,Không yeu cau,Quận 12,NHÂN VIÊN KẾ TOÁN KIÊM GHI DANH,CV2022-26235
CÔNG TY TNHH XNK CƠ ĐIỆN LẠNH SONG ANH,22/04/2022,Nhân viên,,2,Không yeu cau,Quận Tân Bình,Kế Toán Nội Bộ,CV2022-26227
DN TƯ NHÂN CHỊ NHƯ,25/04/2022,Nhân viên,,Không yêu cầu,Không yeu cau,Quận 9,NHÂN VIÊN BÁN THỜI GIAN ( PART TIME) TUYỂN SV,CV2022-26238
CÔNG TY TNHH MTV HUỲNH VIÊN,28/04/2022,Nhân viên,,Không yêu cầu,Không yeu cau,Quận 10,KẾ TOÁN VIÊN,CV2022-26245
CÔNG TY TNHH ASIA PACIFIC ENGRAVERS (VIET NAM),29/04/2022,Nhân viên,,Không yêu cầu,Không yeu cau,Quận Bình Tân,VẬN HÀNH MÁY,CV2022-26249
CÔNG TY TNHH NGUYÊN TÂM 68,29/04/2022,Nhân viên,,Không yêu cầu,Không yeu cau,Quận 7,NHÂN VIÊN BÁN HÀNG,CV2022-26250
CÔNG TY TNHH HB&IE;,29/04/2022,Nhân viên,,Không yêu cầu,Không yeu cau,"Quận 7, Quận 8, Quận 10, Quận Bình Tân, Quận Tân Phú",BÁN HÀNG,CV2022-26251
Tập đoàn KSFinance,30/04/2022,Trưởng phòng,,3,Không yeu cau,Quận 3,TRƯỞNG PHÒNG KINH DOANH,CV2022-26252
CÔNG TY TNHH AMEE VN,05/05/2022,Nhân viên,,Không yêu cầu,Không yeu cau,Quận 7,CHĂM SÓC KHÁCH HÀNG,CV2022-26254
NGÂN HÀNG TMCP QUÂN ĐỘI – CHI NHÁNH AN PHÚ,05/05/2022,Nhân viên,,Không yêu cầu,Không yeu cau,Quận 2,NHÂN VIÊN KINH DOANH,CV2022-26256
NHÀ HÀNG TANDOOR,10/05/2022,Nhân viên,,Không yêu cầu,Không yeu cau,Quận 1,THU NGÂN / PHỤC VỤ / PHỤ BẾP,CV2022-26258
NHÀ HÀNG NHẬT BẢN HOA TUYẾT,10/05/2022,Nhân viên,,Không yêu cầu,Không yeu cau,Quận 1,TẠP VỤ / PHỤC VỤ,CV2022-26262
CÔNG TY CỔ PHẦN THỦY SẢN TRƯỜNG PHÁT,10/05/2022,Nhân viên,,Không yêu cầu,Không yeu cau,Quận 1,NHÂN VIÊN VĂN PHÒNG,CV2022-26263
CÔNG TY LUẬT TNHH NGƯỜI ĐỒNG HÀNH,11/05/2022,Nhân viên,,Không yêu cầu,Không yeu cau,Quận 7,NHÂN VIÊN ADMIN THÔNG TIN,CV2022-26260
CÔNG TY  KẸP TÓC NAM PHƯƠNG,11/05/2022,Nhân viên,,Không yêu cầu,Không yeu cau,Quận 1,NHÂN VIÊN GIAO HÀNG,CV2022-26265
CÔNG TY TNHH MỘT THÀNH VIÊN THƯƠNG MẠI MF,11/05/2022,Nhân viên,,Không yêu cầu,Không yeu cau,Quận 3,NHÂN VIÊN BẢO VỆ,CV2022-26264
NHÀ HÀNG BA MIỀN,11/05/2022,Nhân viên,,Không yêu cầu,Không yeu cau,Quận 3,NHÂN VIÊN PHỤC VỤ / TẠP VỤ / PHỤ BẾP,CV2021-25874
PHÂN VIỆN CƠ ĐIỆN NÔNG NGHIỆP VÀ CÔNG NGHỆ STH (FOLI),17/05/2022,Nhân viên,,Không yêu cầu,Không yeu cau,Quận 1,CÔNG NHÂN SẢN XUẤT THỰC PHẨM,CV2022-26272
HỆ THỐNG NHÀ HÀNG HÀN QUỐC KIMBAP CITY,17/05/2022,Nhân viên,,Không yêu cầu,Không yeu cau,Quận 3,ĐẦU BẾP / PHỤ BẾP / TẠP VỤ / PHỤC VỤ,CV2022-26274
CÔNG TY  KẸP TÓC NAM PHƯƠNG,23/05/2022,Nhân viên,,Không yêu cầu,Không yeu cau,Quận 1,NHÂN VIÊN GIAO HÀNG/NHÂN VIÊN KHO,CV2022-26284
CÔNG TY TNHH GUTA VIỆT NAM,24/05/2022,Nhân viên,,Không yêu cầu,Không yeu cau,Quận 1,CỬA HÀNG TRƯỞNG /CA TRƯỞNG,CV2022-26290
CÔNG TY VIỆT VISA,26/05/2022,Nhân viên,,Không yêu cầu,Không yeu cau,Quận 1,VĂN PHÒNG/ GIAO NHẬN,CV2022-26295
CÔNG TY TNHH TM DV  DẦU NHỚT SONG PHÁT,31/05/2022,Nhân viên,,Không yêu cầu,Không yeu cau,Quận Bình Thạnh,NHÂN VIÊN KINH DOANH,CV2022-26298
CÔNG TY TNHH BẢO HIỂM NHÂN THỌ CATHAY VIỆT NAM,31/05/2022,Nhân viên,,2,Không yeu cau,Quận 3,QUẢN LÝ KINH DOANH,CV2022-26300
CHI NHÁNH CÔNG TY CỔ PHẦN ZEGAL  VIỆT NAM,31/05/2022,Nhân viên,,Không yêu cầu,Không yeu cau,Quận 11,THỢ THI CÔNG NỘI THẤT,CV2022-26303
CÔNG TY TNHH TM DV THÉP KHƯƠNG MAI,02/06/2022,Nhân viên,,Không yêu cầu,Không yeu cau,Quận 11,TRƯỞNG PHÒNG KINH DOANH/GIÁM ĐỐC CHI NHÁNH/NHÂN VIÊN KINH DOANH/KẾ TOÁN,CV2022-26307
CÔNG TY TNHH THƯƠNG MẠI DỊCH VỤ BẢO VỆ ĐẠI PHÚC,07/06/2022,Nhân viên,,Không yêu cầu,Không yeu cau,"Quận 10, Quận Bình Tân, Quận Tân Phú",BẢO VỆ - VỆ SĨ - AN NINH,CV2022-26312
CÔNG TY TNHH KINH DOANH GIA THÁI,01/06/2022,Nhân viên,,1,Không yeu cau,Quận Tân Bình,NHÂN VIÊN KINH DOANH,CV2022-26297
BÁNH MÌ NGƯỜI SÀI GÒN,08/06/2022,Nhân viên,,Không yêu cầu,Không yeu cau,Quận 5,PHỤC VỤ / BÁN HÀNG,CV2022-26315
CÔNG TY CỔ PHẦN XÂY DỰNG  HUYỀN MINH,13/06/2022,Nhân viên,,3,Không yeu cau,Quận Gò Vấp,KỸ SƯ/TÀI CHÍNH KẾ TOÁN,CV2022-26316
CTY TNHH MTV DỊCH VỤ HÀNG HẢI  ĐẠI THỊNH PHÁT,14/06/2022,Nhân viên,,Không yêu cầu,Không yeu cau,Quận Bình Thạnh,GIAO NHẬN HÀNG HÓA,CV2022-26318
CÔNG TY TNHH CƠ KHÍ CHÍNH XÁC NHÀ BÈ,15/06/2022,Nhân viên,,Không yêu cầu,Không yeu cau,Huyện Nhà Bè,Nhân Viên Cơ Khí,CV2022-26320
CÔNG TY CỔ PHẦN THƯƠNG MẠI DV DU LỊCH DANDY ISLAND,21/06/2022,Nhân viên,,Không yêu cầu,Không yeu cau,Quận 1,NHÂN VIÊN KẾ TOÁN,CV2022-26331
"PHƯƠNG NAM CO.,LTD",21/06/2022,Nhân viên,,Không yêu cầu,Không yeu cau,Quận Tân Bình,LAO ĐỘNG PHỔ THÔNG (BAO Ở),CV2022-26325
CÔNG TY ĐIỆN CHÂU Á,21/06/2022,Nhân viên,,1,Không yeu cau,Quận 5,KẾ TOÁN BÁN HÀNG/NHÂN VIÊN KINH DOANH,CV2022-26328
CÔNG TY TNHH 8 FOOD (NHÀ HÀNG KOREA PALSAIK),22/06/2022,Nhân viên,,Không yêu cầu,Không yeu cau,Quận 1,PHỤC VỤ / BẾP,CV2022-26333
CÔNG TY TNHH AURORA IGROUP,28/06/2022,Nhân viên,,Không yêu cầu,Không yeu cau,Quận 3,NHÂN VIÊN LỄ TÂN / PHỤC VỤ NHÀ HÀNG / PHỤC VỤ CAFÉ,CV2022-26336
CÔNG TY TNHH TÂM MINH TÂM,28/06/2022,Nhân viên,,Không yêu cầu,Không yeu cau,Quận 1,NHÂN VIÊN TIẾP TÂN/ LĐPT,CV2022-26319
VPH EXPRESS,30/06/2022,Nhân viên,,Không yêu cầu,Không yeu cau,Quận Bình Tân,NHÂN VIÊN TRỰC WEB,CV2022-26341
CÔNG TY TNHH BAO BÌ SAN MIGUEL YAMAMURA PHÚ THỌ,30/06/2022,Nhân viên,,1,Không yeu cau,Quận 12,KINH DOANH / MARKETING ASSISTANT,CV2022-26342
CÔNG TY TNHH BAO BÌ SAN MIGUEL YAMAMURA PHÚ THỌ,30/06/2022,Nhân viên,,Không yêu cầu,Không yeu cau,Quận 12,VẬN HÀNH MÁY TỰ ĐỘNG,CV2022-26343
CTY TNHH CAO PHONG SIÊU THỊ ĐIỆN MÁY NỘI THẤT CHỢ LỚN,04/07/2022,Nhân viên,,Không yêu cầu,Không yeu cau,Quận 5,BUỒNG PHÒNG/BẾP CHÍNH/PHỤ BẾP/TẠP VỤ/PHỤC VỤ,CV2022-26344
CT TNHH XNK CHÂU MINH,05/07/2022,Nhân viên,,Không yêu cầu,Không yeu cau,Quận Bình Tân,NHÂN VIÊN KINH DOANH ( PHỤ GIA VÀ HÓA CHẤT CÁC NGÀNH),CV2022-26345
TẤT KÝ MÌ GIA,05/07/2022,Nhân viên,,Không yêu cầu,Không yeu cau,Quận 10,PHỤC VỤ,CV2022-26346
CHĂM SÓC DA VENUS,05/07/2022,Nhân viên,,Không yêu cầu,Không yeu cau,Quận 1,KỸ THUẬT VIÊN CHĂM SÓC DA,CV2022-26347
CÔNG TY CỔ PHẦN TẬP ĐOÀN ĐẠI PHÁT,05/07/2022,Nhân viên,,Không yêu cầu,Không yeu cau,"Quận 5, Quận Bình Tân",LAO ĐỘNG PHỔ THÔNG / NHÂN VIÊN KINH DOANH,CV2022-26304
CÔNG TY TNHH ICSB VIỆT NAM,07/07/2022,Nhân viên,,Không yêu cầu,Không yeu cau,Quận 4,GIÁM ĐỊNH VIÊN / KẾ TOÁN,CV2022-26351
CTY TNHH SKYMART,07/07/2022,Nhân viên,,3,Không yeu cau,Quận 1,KẾ TOÁN CÔNG NỢ,CV2022-26352
BƯU CHÍNH VIETTEL BÌNH THẠNH,11/07/2022,Nhân viên,,Không yêu cầu,Không yeu cau,Quận Bình Thạnh,NHÂN VIÊN BƯU TÁ GIAO/NHẬN HÀNG BẰNG XE MÁY,CV2022-26356
CTY TNHH NGUYÊN KHANG,12/07/2022,Nhân viên,,Không yêu cầu,Không yeu cau,Huyện Hóc Môn,LAO ĐỘNG PHỔ THÔNG (BAO ĂN Ở),CV2022-26359
CÔNG TY TNHH THE LAB,12/07/2022,Nhân viên,,Không yêu cầu,Không yeu cau,Quận 3,NHÂN VIÊN PHỤC VỤ,CV2022-26362
PHÂN BÓN BA LÁ XANH,14/07/2022,Nhân viên,,Không yêu cầu,Không yeu cau,Quận 1,KINH DOANH,CV2022-26366
Công Ty TNHH BĐS & XD Tấn Thịnh Phát,15/07/2022,Nhân viên,,Không yêu cầu,Không yeu cau,Quận Thủ Đức,Kế Toán và Thư Ký,CV2022-26368
Cty HỆ THỐNG  RÈM TỰ ĐỘNG HTD,18/07/2022,Nhân viên,,Không yêu cầu,Không yeu cau,Quận 1,NHÂN VIÊN KĨ THUẬT,CV2022-26370
SHINHAN BANK,19/07/2022,Nhân viên,,Không yêu cầu,Không yeu cau,Quận 8,NHÂN VIÊN TÀI CHÍNH - TIÊU DÙNG,CV2022-26363
TRƯỜNG THPT THÀNH NHÂN,20/07/2022,Nhân viên,,Không yêu cầu,Không yeu cau,Quận Tân Phú,GIÁO VIÊN NỘI TRÚ,CV2022-26372
CÔNG TY TNHH DỊCH VỤ BẢO VỆ TRÍ TÂM (WTS),21/07/2022,Nhân viên,,Không yêu cầu,Không yeu cau,"Quận 1, Quận 2, Quận 3, Quận 4, Quận 5, Quận 6, Quận 7, Quận 8, Quận 9, Quận 10, Quận 11, Quận 12, Quận Bình Thạnh, Quận Gò Vấp, Quận Phú nhuận, Quận Tân Bình, Quận Tân Phú, Quận Thủ Đức",BẢO VỆ,CV2022-26373
SHOP SƠN NAM 851,21/07/2022,Nhân viên,,Không yêu cầu,Không yeu cau,Quận 1,NHÂN VIÊN BÁN HÀNG,CV2022-26375
CÔNG TY TNHH ĐẦU TƯ DỊCH VỤ HUM VIỆT NAM,21/07/2022,Nhân viên,,Không yêu cầu,Không yeu cau,Quận 1,NHÂN VIÊN NHÀ HÀNG,CV2022-26376
AGRIBank Chi Nhánh 3,29/07/2022,Nhân viên,,Không yêu cầu,Không yeu cau,Quận 3,NHÂN VIÊN VĂN THƯ,CV2022-26382
CÔNG TY TNHH DVVT PHÚC ÂN,30/07/2022,Nhân viên,,1,Không yeu cau,Quận Tân Bình,TÀI XẾ XE TẢI NHỎ,CV2022-26383
VNPT TP Hồ Chí Minh,02/08/2022,Nhân viên,,Không yêu cầu,Không yeu cau,Quận 1,Nhân viên Kinh doanh khối doanh nghiệp (AM) - Nhân viên Kinh doanh khối khách hàng cá nhân,CV2022-26385
CÔNG TY TNHH THƯƠNG MẠI- DỊCH VỤ XUẤT NHẬP KHẨU TẤT HỮU HƯNG,02/08/2022,Nhân viên,,Không yêu cầu,Không yeu cau,Quận Gò Vấp,NHÂN VIÊN XUẤT NHẬP KHẨU,CV2016-A2177
CÔNG TY CỔ PHẦN THƯƠNG MẠI VÀ XUẤT NHẬP KHẨU TRANG LINH,02/08/2022,Nhân viên,,Không yêu cầu,Không yeu cau,Quận 8,VĂN PHÒNG / KỸ THUẬT VIÊN,CV2022-26386
CÔNG TY TNHH TM XD DV NHÀ ĐẤT MINH ĐỨC,02/08/2022,Nhân viên,,Không yêu cầu,Không yeu cau,Quận 11,KẾ TOÁN KIÊM HÀNH CHÁNH / KINH DOANH,CV2022-26387
CÔNG TY TNHH ĐẦU TƯ VÀ PHÁT TRIỂN BĐS THIÊN PHƯỚC,03/08/2022,Nhân viên,,Không yêu cầu,Không yeu cau,Quận Tân Bình,TRỢ LÝ VĂN PHÒNG / KINH DOANH,CV2022-26389
TRUNG TÂM BẢO HÀNH MÁY PHÁT ĐIỆN – UPS HYUNDAI,04/08/2022,Nhân viên,,Không yêu cầu,Không yeu cau,Quận 12,KỸ THUẬT VIÊN MÁY PHÁT ĐIỆN- BỘ LƯU ĐIỆN,CV2022-26392
CÔNG TY CP TM XNK  HOÀNG SA,08/08/2022,Nhân viên,,Không yêu cầu,Không yeu cau,Quận Tân Phú,NHÂN VIÊN KINH DOANH/NHÂN VIÊN GIÁM SÁT,CV2022-26396
PHÒNG KHÁM NỘI TỔNG QUÁT,10/08/2022,Nhân viên,,Không yêu cầu,Không yeu cau,Quận 5,ĐIỀU DƯỠNG,CV2022-26398
CÔNG TY TNHH PHÂN PHỐI SÀNH ĐIỆU (ANNAM GOURMET),09/08/2022,Nhân viên,,Không yêu cầu,Không yeu cau,"Quận 1, Quận 2, Quận 7, Quận Bình Thạnh, Quận Phú nhuận",NHÂN VIÊN SIÊU THỊ,CV2022-26400
CÔNG TY CỔ PHẦN VILACASA VIỆT NAM,11/08/2022,Nhân viên,,Không yêu cầu,Không yeu cau,"Quận 2, Quận 7, Quận 10, Quận Gò Vấp, Quận Phú nhuận",NHÂN VIÊN BÁN HÀNG,CV2022-26388
Công Ty TNHH Nabati Việt Nam,15/08/2022,Nhân viên,,Không yêu cầu,Không yeu cau,"Quận Bình Tân, Quận Gò Vấp, Huyện Hóc Môn","Sales Thị Trường Kênh GT Khu Vực HCM (Gò Vấp, Bình Tân, Hóc Môn)",CV2022-26403
CÔNG TY TNHH HƯNG THUẬN PHÁT,16/08/2022,Nhân viên,,Không yêu cầu,Không yeu cau,Quận Tân Phú,NHÂN VIÊN VĂN PHÒNG (NỮ),CV2022-26391
TỔ CHỨC TÀI CHÍNH VI MÔ CEP,16/08/2022,Nhân viên,,Không yêu cầu,Không yeu cau,Quận 1,NHÂN VIÊN TÍN DỤNG / ĐẢNG VỤ,CV2022-26407
CÔNG TY TNHH SX TM DV HOA ĐẤT VIỆT,18/08/2022,Nhân viên,,Không yêu cầu,Không yeu cau,Quận 10,NHÂN VIÊN BÁN HÀNG,CV2022-26406
CÔNG TY CỔ PHẦN PHÁT TRIỂN SUNWELL,18/08/2022,Nhân viên,,Không yêu cầu,Không yeu cau,Quận 10,NHÂN VIÊN KINH DOANH/CỘNG TÁC VIÊN/KỸ SƯ ĐIỆN,CV2022-26412
CN CÔNG TY TNHH THIẾT BỊ VÀ DỤNG CỤ TÂN THÀNH PHÁT,09/10/2020,Nhân viên,,Không yêu cầu,Không yeu cau,Quận Gò Vấp,NHÂN VIÊN KINH DOANH,CV2020-25718
CÔNG TY TNHH MTV BỐN DÒNG KẺ,28/08/2020,Nhân viên,,Không yêu cầu,Không yeu cau,Quận Thủ Đức,"LAO ĐỘNG PHỔ THÔNG ( công nhân may, ủi, phụ, LDPT)",CV2020-25666
CÔNG TY TNHH SX TM CẦU TRỤC HOÀNG ANH,18/07/2020,Nhân viên,,1,Không yeu cau,Huyện Hóc Môn,THỢ ĐIỆN CÔNG NGHIỆP,CV2020-25633
COFFEE XƯA,22/06/2020,Nhân viên,,Không yêu cầu,Không yeu cau,Quận Thủ Đức,NHÂN VIÊN PHỤC VỤ - PHA CHẾ,CV2020-25606
CÔNG TY TNHH THỢ LÀM BÁNH,21/05/2020,Nhân viên,,Không yêu cầu,Không yeu cau,Quận Bình Thạnh,NHÂN VIÊN ĐÓNG GÓI,CV2020-25574
CÔNG TY DỊCH VỤ BẢO VỆ NGÂN HÀNG Á CHÂU,23/04/2020,Nhân viên,,Không yêu cầu,Không yeu cau,Quận 10,NHÂN VIÊN BẢO VỆ ( NGÂN HÀNG ),CV2020-25533
CÔNG TY TNHH TMDV TBVSCN ĐẠI DƯƠNG XANH,10/03/2020,Nhân viên,,1,Không yeu cau,Quận 8,NHÂN VIÊN KINH DOANH,CV2020-25511
TRƯỜNG ĐẠI HỌC GREENWICH VIỆT NAM,19/02/2020,Nhân viên,,Không yêu cầu,Không yeu cau,"Quận 6, Quận Bình Thạnh",CHUYÊN VIÊN TƯ VẤN KHÁCH HÀNG/ NHÂN VIÊN TELESALE,CV2020-25482
CÔNG TY TNHH MTV SX TM DV BÁNH KẸO HỶ LÂM MÔN,06/02/2020,Nhân viên,,Không yêu cầu,Không yeu cau,Quận 5,Nhân Viên Bán Hàng,CV2018-23318
CÔNG TY TNHH DAWON VIET NAM,25/12/2019,Nhân viên,,Không yêu cầu,Không yeu cau,Quận Tân Bình,1/ NHÂN VIÊN SALE - 2/ NHÂN VIÊN GIAO HÀNG,CV2019-25408
DNTN THẢM LEN SÀI GÒN,27/11/2019,Nhân viên,,Không yêu cầu,Không yeu cau,Quận 1,NHÂN VIÊN BÁN HÀNG,CV2019-25374
CÔNG TY TNHH SƠN HẢI VÂN,13/11/2019,Nhân viên,,Không yêu cầu,Không yeu cau,H.Bến Lức,KẾ TOÁN NỘI BỘ,CV2019-25343
CÔNG TY TNHH TM XD XNK TRƯƠNG PHAN,25/10/2019,Nhân viên,,Không yêu cầu,Không yeu cau,Quận Gò Vấp,NHÂN VIÊN KINH DOANH,CV2019-25306
McDonald's Vietnam,15/10/2019,Nhân viên,,Không yêu cầu,Không yeu cau,Quận 1,NHÂN VIÊN BẾP VÀ PHỤC VỤ,CV2019-25273
NHÀ HÀNG PHỐ NHỎ,08/10/2019,Nhân viên,,Không yêu cầu,Không yeu cau,Quận 1,NHÂN VIÊN PHỤC VỤ,CV2019-25247
CÔNG TY TNHH IN BAO BÌ HOÀNG ANH,23/09/2019,Nhân viên,,Không yêu cầu,Không yeu cau,Quận 3,NHÂN VIÊN THIẾT KẾ,CV2019-25211
CÔNG TY TNHH M.E.A,05/09/2019,Nhân viên,,Không yêu cầu,Không yeu cau,Quận Bình Thạnh,"LAO ĐỘNG PHỔ THÔNG/ THỢ HÀN, ĐIỆN – ĐIỆN TỬ/ TÀI XẾ XE TẢI",CV2019-25063
CÔNG TY TNHH DƯỢC PHẨM VỊ ĐỨC,09/09/2019,Nhân viên,,Không yêu cầu,Không yeu cau,Quận 11,KẾ TOÁN TỔNG HỢP - NHÂN VIÊN VĂN PHÒNG,CV2019-25182
CÔNG TY CỔ PHẦN ĐẦU TƯ NGỌC PHƯƠNG ĐÔNG,10/09/2019,Nhân viên,,Không yêu cầu,Không yeu cau,Quận 2,NHÂN VIÊN KINH DOANH,CV2019-25183
