name_company,upadte_date,rank,age,level,experience,salary,Tên công việc,Mã công việc
Công ty TNHH ALPHA Việt Nam (KIRIFURI),20/06/2023,Nhân viên,,Không yêu cầu,Không yeu cau,Quận Bình Thạnh,GIAO HÀNG,CV2022-26535
CTY TƯ VẤN XÂY DỰNG HOÀNG LÊ,21/06/2023,Nhân viên,,Không yêu cầu,Không yeu cau,Quận Gò Vấp,KẾ TOÁN NỘI BỘ CÔNG TRÌNH/ KẾ TOÁN TỔNG HỢP (CTV),CV2023-26741
CTY TNHH THƯƠNG MẠI VÀ ĐẦU TƯ PHÚC NGUYỄN,21/06/2023,Nhân viên,,1,Không yeu cau,Quận Gò Vấp,KẾ TOÁN KHO (CTV),CV2023-26689
CTY CP HỌC VIỆN ĐÀO TẠO CMA,21/06/2023,Nhân viên,,Không yêu cầu,Không yeu cau,Quận Thủ Đức,Kế toán (CTV),CV2023-26684
CÔNG TY TNHH MTV MINH ANH HÙNG THỊNH,23/06/2023,Nhân viên,,Không yêu cầu,Không yeu cau,Quận Gò Vấp,NHÂN VIÊN KINH DOANH / TELESALES,CV2023-26756
KHÁCH SẠN - NHÀ HÀNG LÚA ĐẠI VIỆT,23/06/2023,Nhân viên,,Không yêu cầu,Không yeu cau,Quận 1,PHA CHẾ QUẦY BAR / PHỤC VỤ / BẾP ÂU,CV2023-26705
SHOP TRÁI CÂY NGỌC HẢO,30/06/2023,Nhân viên,,Không yêu cầu,Không yeu cau,Quận 1,BÁN TRÁI CÂY (bao ăn) (CTV),CV2023-26659
CÔNG TY TNHH WAKYO MAGALL,07/07/2023,Nhân viên,,Không yêu cầu,Không yeu cau,Quận Bình Thạnh,LAO ĐỘNG PHỔ THÔNG,CV2023-26727
CÔNG TY TNHH THỊNH PHÁT,11/07/2023,Nhân viên,,Không yêu cầu,Không yeu cau,Quận 6,NHÂN VIÊN PHÁT TRIỂN THỊ TRƯỜNG,CV2023-26761
CÔNG TY CỔ PHẦN SẢN XUẤT THƯƠNG MẠI ĐẠI ĐOÀN KẾT,13/07/2023,Nhân viên,,Không yêu cầu,Không yeu cau,Quận Gò Vấp,NHÂN VIÊN KINH DOANH / CHĂM SÓC KHÁCH HÀNG / PHỤ BẾP,CV2023-26702
Công Ty TNHH Dược Phẩm Và Trang Thiết Bị Y Tế Uss Pharma Liên Doanh Copharma,13/07/2023,Nhân viên,,Không yêu cầu,Không yeu cau,Quận 8,KẾ TOÁN KHO/ THẦU/ HÀNH CHÍNH VĂN PHÒNG/ CSKH,CV2023-26735
CÔNG TY TNHH BEN COFFEE HOUSE,13/07/2023,Nhân viên,,Không yêu cầu,Không yeu cau,Quận 1,PHỤC VỤ / PHA CHẾ,CV2022-26565
CÔNG TY TNHH SÀI GÒN MAY MẶC XUẤT KHẨU,17/07/2023,Nhân viên,,Không yêu cầu,Không yeu cau,Quận Phú nhuận,"KỸ THUẬT MAY, TỔ TRƯỞNG MAY, CÔNG NHÂN MAY MẶC (CTV)",CV2023-26748
CÔNG TY TNHH THƯƠNG MẠI ĐĂNG NHẬT - QUẬN 10,18/07/2023,Nhân viên,,Không yêu cầu,Không yeu cau,Quận 10,TELESALES / TÀI XẾ / KIỂM HÀNG,CV2023-26592
CÔNG TY TNHH MTV DV  KỸ THUẬT & THƯƠNG MẠI NGỌC MINH,18/07/2023,Nhân viên,,Không yêu cầu,Không yeu cau,Quận Tân Bình,NHÂN VIÊN TÀI XẾ,CV2022-26384
C.TY TNHH TM DV XUẤT NHẬP KHẨU TẤT HỮU HƯNG,18/07/2023,Nhân viên,,Không yêu cầu,Không yeu cau,Quận Gò Vấp,NHÂN VIÊN GIAO NHẬN XUẤT NHẬP KHẨU,CV2023-26766
TRƯỜNG THPT THỦ KHOA HUÂN,25/07/2023,Nhân viên,,Không yêu cầu,Không yeu cau,"Quận Tân Bình, Quận Tân Phú",BẢO VỆ TRƯỜNG HỌC CTV (CÓ CHỖ Ở LẠI),CV2023-26769
TRƯỜNG THPT THỦ KHOA HUÂN,29/07/2023,Nhân viên,,Không yêu cầu,Không yeu cau,"Quận Tân Bình, Quận Tân Phú",BẾP TRƯỞNG (BAO Ở),CV2023-26775
"TRUNG TÂM GIỐNG CÂY TRỒNG, VẬT NUÔI VÀ THUỶ SẢN",03/08/2023,Nhân viên,,Không yêu cầu,Không yeu cau,Huyện Bình Chánh,"HÀNH CHÍNH TỔNG HỢP, KẾ TOÁN, KIỂM TRA CHẤT LƯỢNG, DỊCH VỤ CUNG ỨNG GIỐNG",CV2023-26718
CÔNG TY TNHH DU LỊCH KIM,03/08/2023,Nhân viên,,Không yêu cầu,Không yeu cau,Quận 1,NHÂN VIÊN TƯ VẤN,CV2023-26777
TRƯỜNG THPT THỦ KHOA HUÂN,15/08/2023,Nhân viên,,Không yêu cầu,Không yeu cau,"Quận Tân Bình, Quận Tân Phú",PHỤ BẾP (BAO ĂN Ở) CTV,CV2023-26781
CÔNG TY CỔ PHẦN THÉP VIỆT THÀNH LONG AN,18/08/2023,Nhân viên,,Không yêu cầu,Không yeu cau,Quận 5,KẾ TOÁN,CV2023-26784
TƯ NHÂN ANH THÀNH,17/08/2023,Nhân viên,,Không yêu cầu,Không yeu cau,Huyện Bình Chánh,LAO ĐỘNG PHỔ THÔNG (BAO Ở) CTV,CV2023-26783
DỊCH VỤ BẢO VỆ CÔNG THỊNH,19/08/2023,Nhân viên,,Không yêu cầu,Không yeu cau,"Quận 1, Quận 2, Quận Thủ Đức",BẢO VỆ (CTV),CV2023-26785
PHÒNG ĐẠO TẠO - TRUNG TÂM DỊCH VỤ VIỆC LÀM THANH NIÊN TP. HCM,23/08/2023,Nhân viên,,Không yêu cầu,Không yeu cau,Quận 3,GIÁO VIÊN TIN HỌC CẤP TIỂU HỌC,CV2023-26758
CÔNG TY TNHH KUMHO SAMCO BUSLINES,25/08/2023,Nhân viên,,Không yêu cầu,Không yeu cau,Quận 1,TỔNG ĐÀI VIÊN (biết tiếng Kmer) ctv,CV2023-26787
TỔ CHỨC TÀI CHÍNH VI MÔ CEP,28/08/2023,Nhân viên,,Không yêu cầu,Không yeu cau,"Quận 10, Quận 12, Huyện Bình Chánh, Quận Bình Thạnh, Huyện Cần Giờ, Huyện Hóc Môn",Nhân viên tín dụng,CV2023-26788
CÔNG TY TNHH KIM KHÍ ĐIỆN MÁY NỘI THẤT BẢO ĐỨC,06/09/2023,Nhân viên,,Không yêu cầu,Không yeu cau,Quận 12,SALE/ CƠ ĐIỆN LẠNH,CV2023-26780
CÔNG TY TNHH HASU ASIA,06/09/2023,Nhân viên,,Không yêu cầu,Không yeu cau,Quận Phú nhuận,KẾ TOÁN / VĂN PHÒNG,CV2022-26556
CÔNG TY TNHH KIM KHÍ ĐIỆN MÁY NỘI THẤT BẢO ĐỨC,07/09/2023,Nhân viên,,Không yêu cầu,Không yeu cau,Quận 12,SALE/TÀI XẾ/ GIÚP VIỆC [gói GTLĐ],CV2023-26779
GIÚP VIỆC NHÀ (BAO ĂN Ở) CHỊ TRANG,08/09/2023,Nhân viên,,Không yêu cầu,Không yeu cau,Quận 3,GIÚP VIỆC NHÀ (BAO ĂN Ở) CHỊ TRANG,CV2023-26793
CÔNG TY TNHH THƯƠNG MẠI DỊCH VỤ DU LỊCH THÔNG THIÊN,07/09/2023,Nhân viên,,Không yêu cầu,Không yeu cau,Quận 10,NHÂN VIÊN KINH DOANH,CV2023-26792
KHÁCH SẠN - NHÀ HÀNG LÚA ĐẠI VIỆT,12/09/2023,Nhân viên,,Không yêu cầu,Không yeu cau,Quận 1,NHÂN VIÊN BUỒNG PHÒNG,CV2023-26795
TRƯỜNG THPT THỦ KHOA HUÂN,12/09/2023,Nhân viên,,Không yêu cầu,Không yeu cau,"Quận Tân Bình, Quận Tân Phú",BẾP TRƯỞNG + PHỤ BẾP (TRƯỜNG HỌC BAO Ở),CV2023-26796
CÔNG TY TNHH BĐS LÂM THỊ,12/09/2023,Nhân viên,,Không yêu cầu,Không yeu cau,Quận Gò Vấp,KẾ TOÁN / TRỢ LÝ VĂN PHÒNG / KINH DOANH,CV2023-26797
BÁNH MÌ CHÀNG MẬP (CTV),16/09/2023,Nhân viên,,Không yêu cầu,Không yeu cau,Quận Gò Vấp,NHÂN VIÊN BÁN BÁNH MÌ/ PHỤ BÁN BÁNH MÌ (CTV),CV2023-26799
cửa hàng sơn nước,19/09/2023,Nhân viên,,Không yêu cầu,Không yeu cau,Quận Phú nhuận,PHỤ BÁN HÀNG (BAO ĂN) (gói CTV),CV2023-26669
CÔNG TY KOMPONG DEWA,19/09/2023,Nhân viên,,Không yêu cầu,Không yeu cau,Quận 1,CSKH/ Conten Marketing/ Digital Marketing,CV2023-26789
GÀ RÁN PAPA’S CHICKEN (VIỆT AN),22/09/2023,Nhân viên,,2,Không yeu cau,Quận 1,Digital Marketing Executive,CV2023-26805
công ty tnhh phan bảo thiên,09/11/2023,Nhân viên,,Không yêu cầu,Không yeu cau,Huyện Nhà Bè,NHÂN VIÊN BÁN HÀNG VÀ CHĂM SÓC KHÁCH HÀNG,CV2023-26826
Quán APP COFFEE,11/11/2023,Nhân viên,,Không yêu cầu,Không yeu cau,Quận Phú nhuận,NHÂN VIÊN PHỤC VỤ,CV2023-26827
NHÀ HÀNG HOA VIÊN CRAFT BREWERY,20/11/2023,Nhân viên,,Không yêu cầu,Không yeu cau,"Quận 1, Quận Tân Bình",PHỤC VỤ / LỄ TÂN / TẠP VỤ / PHA CHẾ / BẢO TRÌ / BẢO VỆ,CV2023-26831
GÀ RÁN PAPA’S CHICKEN (VIỆT AN),22/11/2023,Nhân viên,,Không yêu cầu,Không yeu cau,Quận 1,KẾ TOÁN CÔNG NỢ + PHỤC VỤ (CỬA HÀNG GÀ RÁN),CV2023-26833
Cà phê Thanh Thanh,22/11/2023,Nhân viên,,Không yêu cầu,Không yeu cau,Quận Bình Tân,PHỤC VỤ CÀ PHÊ (BAO ĂN Ở),CV2023-26834
CÔNG TY TNHH NGOẠI THƯƠNG - NGHIÊN CỨU VÀ  PHÁT TRIỂN PHƯƠNG BẮC,23/11/2023,Nhân viên,,Không yêu cầu,Không yeu cau,Quận 3,NHẬP LIỆU,CV2023-26774
NHÀ HÀNG HOA VIÊN CRAFT BREWERY,24/11/2023,Nhân viên,,Không yêu cầu,Không yeu cau,Quận 1,THU NGÂN / PHỤC VỤ / QUẢN LÝ HÀNH CHÁNH,CV2023-26812
NHÀ VĂN HÓA THANH NIÊN THÀNH PHỐ,24/11/2023,Nhân viên,,Không yêu cầu,Không yeu cau,Quận 1,KỸ THUẬT VIÊN,CV2021-26028
YOGA VIVA,28/11/2023,Nhân viên,,Không yêu cầu,Không yeu cau,Quận 1,NHÂN VIÊN MARKETING,CV2023-26836
AGRIBank Chi Nhánh 3,29/11/2023,Nhân viên,,Không yêu cầu,Không yeu cau,Quận 3,TÀI XẾ,CV2023-26837
CÔNG TY TNHH THƯƠNG MẠI VÀ DỊCH VỤ NZ,04/12/2023,Nhân viên,,Không yêu cầu,Không yeu cau,Quận 12,LAO ĐỘNG PHỔ THÔNG ( NV KỸ THUẬT),CV2023-26839
CÔNG TY TNHH PHỤ LIỆU MAY HẢO VÀ BẢO,12/12/2023,Nhân viên,,Không yêu cầu,Không yeu cau,Quận 4,THỜI VỤ - XẾP TỜ RƠI,CV2023-26844
VƯỜN LAN,12/12/2023,Nhân viên,,Không yêu cầu,Không yeu cau,H.Trảng Bàng,CHĂM SÓC LAN (bao ở),CV2023-26843
DH NAIL,15/12/2023,Nhân viên,,Không yêu cầu,Không yeu cau,Quận Thủ Đức,KỸ THUẬT VIÊN NAIL,CV2023-26846
LIÊN HIỆP CÁC HỘI VĂN HỌC NGHỆ THUẬT THÀNH PHỐ HỒ CHÍ MINH,22/12/2023,Nhân viên,,Không yêu cầu,Không yeu cau,Quận 3,Văn thư - Lưu trữ/ Hành chính tổng hợp,CV2023-26730
Công ty TNHH ALPHA Việt Nam (KIRIFURI),19/12/2023,Nhân viên,,2,Không yeu cau,Quận Bình Thạnh,NHÂN VIÊN QA/NHÂN VIÊN TIẾP THỊ,CV2023-26848
SHOP QUẦN ÁO CHỊ CÚC,26/12/2023,Nhân viên,,Không yêu cầu,Không yeu cau,Quận Bình Tân,"ĐÓNG GÓI HÀNG HÓA, GIAO HÀNG BÁN ONLINE( BAO ĂN Ở)",CV2023-26850
SHOP 941 CHỢ BẾN THÀNH,26/12/2023,Nhân viên,,Không yêu cầu,Không yeu cau,Quận 1,NHÂN VIÊN BÁN HÀNG,CV2023-26851
LIÊN HIỆP CÁC HỘI VĂN HỌC NGHỆ THUẬT THÀNH PHỐ HỒ CHÍ MINH,26/12/2023,Nhân viên,,Không yêu cầu,Không yeu cau,Quận 3,VĂN THƯ / HÀNH CHÁNH,CV2023-26852
CÔNG TY CỔ PHẦN ĐẦU TƯ PHÁT TRIỂN VÀ THƯƠNG MẠI QUỐC TẾ VIỆT AN,03/10/2023,Nhân viên,,Không yêu cầu,Không yeu cau,"Quận 1, Quận 2, Quận 7, Quận Tân Bình",PHỤC VỤ QUÁN GÀ RÁN,CV2023-26763
CÔNG TY TNHH BEN COFFEE HOUSE,03/10/2023,Nhân viên,,Không yêu cầu,Không yeu cau,Quận 1,PHỤC VỤ / PHA CHẾ / BẾP CHÍNH / PHỤ BẾP,CV2022-26163
Công ty TNHH Xe Điện Sài Gòn,04/10/2023,Nhân viên,,Không yêu cầu,Không yeu cau,Quận 3,NHÂN VIÊN BÁN XE ĐẠP ĐIỆN,CV2023-26790
CTY TNHH TM DV VTO PHÚC THỊNH,06/10/2023,Nhân viên,,Không yêu cầu,Không yeu cau,Quận Thủ Đức,ĐÓNG GÓI HÀNG HOÁ,CV2023-26800
CÔNG TY CỔ PHẦN THƯƠNG MẠI DỊCH VỤ VÀ  CHẾ BIẾN THỰC PHẨM MINH ĐỨC,06/10/2023,Nhân viên,,Không yêu cầu,Không yeu cau,"Quận 8, Huyện Bình Chánh",TRỢ LÝ GIÁM ĐỐC / GIAO DỊCH VIÊN / KẾ TOÁN / KỸ SƯ NÔNG NGHIỆP,CV2023-26760
NGÂN HÀNG PHƯƠNG ĐÔNG OCB,09/10/2023,Nhân viên,,Không yêu cầu,Không yeu cau,Quận Tân Bình,TRƯỞNG NHÓM KINH DOANH/NHÂN VIÊN TÍN DỤNG,CV2022-26361
TỔ CHỨC TÀI CHÍNH VI MÔ CEP,17/10/2023,Nhân viên,,Không yêu cầu,Không yeu cau,"Quận 1, Quận 8, Huyện Bình Chánh, Huyện Cần Giờ, Huyện Hóc Môn, Huyện Nhà Bè",Thủ quỹ / Chuyên viên Công nghệ thông tin / Nhân viên tín dụng,CV2023-26647
CÔNG TY TNHH THƯƠNG MẠI DỊCH VỤ H.C,16/10/2023,Nhân viên,,Không yêu cầu,Không yeu cau,Quận 10,NHÂN VIÊN BÁN HÀNG (CTV),CV2023-26810
CT ĐT TÀI CHÍNH NHÀ NƯỚC TP. HỒ CHÍ MINH,17/10/2023,Nhân viên,,Không yêu cầu,Không yeu cau,Quận 1,"NHÂN VIÊN PHÒNG TÍN DỤNG, PHÒNG THẨM ĐỊNH",CV2023-26806
CÔNG TY CỔ PHẦN ĐẦU TƯ THƯƠNG MẠI VÀ DỊCH VỤ BAMBOO,19/10/2023,Nhân viên,,Không yêu cầu,Không yeu cau,Quận Bình Thạnh,NHÂN VIÊN PHỤC VỤ,CV2023-26814
Công ty TNHH Sản Xuất Bao Bì Dương Vinh Hoa,23/10/2023,Nhân viên,,2,Không yeu cau,Quận Bình Tân,NHÂN VIÊN TÀI XẾ,CV2023-26817
CT TNHH TMDV DU LỊCH & VẬN TẢI CM,24/10/2023,Nhân viên,,Không yêu cầu,Không yeu cau,Quận Tân Bình,NHÂN VIÊN KINH DOANH BÁN VÉ XE ( Trong Sân Bay),CV2023-26818
CTY TNHH MỸ PHẨM MIRA,26/10/2023,Nhân viên,,Không yêu cầu,Không yeu cau,Huyện Hóc Môn,NHÂN VIÊN LÀM VƯỜN (BAO Ở),CV2023-26816
CÔNG TY DU LỊCH HOA SEN VIỆT NAM,26/10/2023,Nhân viên,,Không yêu cầu,Không yeu cau,Quận 1,SEO Marketing online/ Phụ việc văn phòng Sale tour du lịch.,CV2023-26737
CÔNG  TY TNHH CƠ ĐIỆN LQC,30/10/2023,Nhân viên,,1,Không yeu cau,Quận 7,GIÁM SÁT THI CÔNG/ KỸ SƯ THIẾT KẾ/ KẾ TOÁN (giám sát thi công hệ thống điều hòa thông gió/ kỹ sư thiết kế đấu thầu hệ thống điều hòa thông gió/ kế toán viên),CV2023-26820
AGRIBank Chi Nhánh 3,31/10/2023,Nhân viên,,Không yêu cầu,Không yeu cau,Quận 3,NHÂN VIÊN TÍN DỤNG - KẾ TOÁN VIÊN,CV2023-26823
KHÁCH SẠN VŨ GIA,01/11/2023,Nhân viên,,Không yêu cầu,Không yeu cau,Quận 1,LỄ TÂN KHÁCH SẠN,CV2023-26824
CTY TNHH MỸ PHẨM MIRA,04/11/2023,Nhân viên,,Không yêu cầu,Không yeu cau,Quận Tân Bình,BẢO VỆ GIỮ XE (CA ĐÊM) (GOI CTV),CV2023-26815
CÔNG TY TNHH DƯỢC HỒNG LỘC PHÁT,07/11/2023,Nhân viên,,Không yêu cầu,Không yeu cau,Quận Bình Tân,TRÌNH DƯỢC VIÊN BỆNH VIỆN ETC,CV2023-26825
TRUNG TÂM CA NHẠC NHẸ TPHCM,09/01/2024,Nhân viên,,Không yêu cầu,Không yeu cau,Quận 3,NỮ TẠP VỤ (CTV),CV2024-26859
SALON THANH THẢO,19/01/2024,Nhân viên,,Không yêu cầu,Không yeu cau,Quận 8,THỢ PHỤ SALON TÓC,CV2024-26867
CÔNG TY CỔ PHẦN TÂN VIỆT SIN FOODS,21/02/2024,Nhân viên,,Không yêu cầu,Không yeu cau,Quận 8,THỢ ĐIỆN LẠNH / LĐPT,CV2022-26557
CÔNG TY TNHH D. I,26/02/2024,Nhân viên,,Không yêu cầu,Không yeu cau,Quận Thủ Đức,NHÂN VIÊN VẼ/THIẾT KẾ SẢN PHẨM 2D-3D,CV2023-26782
CÔNG TY TNHH BẢO VỆ ĐỨC VIỆT 79,27/02/2024,Nhân viên,,1,Không yeu cau,Quận Gò Vấp,NHÂN VIÊN SALE,CV2024-26879
TẬP ĐOÀN BE GROUP,27/02/2024,Nhân viên,,Không yêu cầu,Không yeu cau,Quận 6,TRÌNH DƯỢC VIÊN/ GIÁM ĐỐC ASM,CV2024-26878
Công Ty Cổ Phần Đầu Tư Địa Ốc Sài Gòn King Land,27/02/2024,Nhân viên,,Không yêu cầu,Không yeu cau,"Quận 5, Quận 6",NHÂN VIÊN KINH DOANH,CV2024-26877
CTY TNHH MỸ PHẨM MIRA,27/02/2024,Nhân viên,,Không yêu cầu,Không yeu cau,Quận Tân Bình,KIỂM TRA CHẤT LƯỢNG MỸ PHẨM QC (1T),CV2024-26876
CTY TNHH MỸ PHẨM MIRA,27/02/2024,Nhân viên,,Không yêu cầu,Không yeu cau,Quận Tân Bình,KẾ TOÁN BÁN HÀNG (1T),CV2024-26875
GIÚP VIỆC NHÀ (BAO ĂN Ở) CHỊ TRANG,27/02/2024,Nhân viên,,Không yêu cầu,Không yeu cau,Quận 3,GIÚP VIỆC NHÀ (BAO ĂN Ở) CHỊ TRANG,CV2024-26874
CÔNG TY TNHH SX TM DV DƯƠNG HƯNG THỊNH,27/02/2024,Nhân viên,,1,Không yeu cau,Quận Gò Vấp,NHÂN VIÊN KẾ TOÁN,CV2024-26872
Cty CP Thịnh Phát GP,27/02/2024,Nhân viên,,Không yêu cầu,Không yeu cau,Quận Bình Tân,TẠP VỤ VĂN PHÒNG,CV2024-26871
CTY TNHH DỊCH VỤ BẤT ĐỘNG SẢN EHOUSE,27/02/2024,Nhân viên,,5,Không yeu cau,Quận 1,HÀNH CHÍNH NHÂN SỰ,CV2024-26855
CÔNG TY ĐỊA ỐC MINH ĐỨC,01/03/2024,Nhân viên,,Không yêu cầu,Không yeu cau,Quận 11,"TRƯỞNG, PHÓ PHÒNG KINH DOANH/SALES BẤT ĐỘNG SẢN",CV2024-26881
TƯ NHÂN ANH CÔNG,19/03/2024,Nhân viên,,Không yêu cầu,Không yeu cau,Quận 12,LAO ĐỘNG PHỔ THÔNG (BAO ĂN Ở) CTV,CV2023-26842
GGS - HÀNG CAO CẤP,19/03/2024,Nhân viên,,Không yêu cầu,Không yeu cau,"Quận 7, Huyện Nhà Bè",BÁN HÀNG ONLINE,CV2024-26889
HỆ THỐNG BÁNH MÌ AN NA,25/03/2024,Nhân viên,,Không yêu cầu,Không yeu cau,Quận 6,LAO ĐỘNG PHỔ THÔNG ( BÁN BÁNH MÌ) ( bao ăn ở),CV2024-26891
NHÀ HÀNG HOA VIÊN CRAFT BREWERY,25/03/2024,Nhân viên,,Không yêu cầu,Không yeu cau,"Quận 1, Quận Tân Bình",PHỤC VỤ / LỄ TÂN / TẠP VỤ / PHA CHẾ / BẢO TRÌ / BẢO VỆ,CV2023-26849
CTY TNHH KHẢI HƯNG,28/03/2024,Nhân viên,,Không yêu cầu,Không yeu cau,Quận 12,THÊU VI TÍNH (BAO ĂN Ở) CTV,CV2024-26894
CÔNG TY TNHH THƯƠNG MẠI & DỊCH VỤ MỸ ĐÌNH,28/03/2024,Nhân viên,,Không yêu cầu,Không yeu cau,Quận Gò Vấp,NHÂN VIÊN KINH DOANH,CV2024-26895
GÀ RÁN PAPA’S CHICKEN (VIỆT AN),30/03/2024,Nhân viên,,Không yêu cầu,Không yeu cau,"Quận 1, Quận 7",PHỤC VỤ / THU NGÂN / BẾP / KẾ TOÁN,CV2022-26554
CÔNG TY NHÀ SẠCH ÂU CƠ,01/04/2024,Nhân viên,,Không yêu cầu,Không yeu cau,Quận 7,NHÂN VIÊN VỆ SINH,CV2024-26892
CỬA HÀNG ĐỒNG HỒ HẠNH CƯỜNG (shopdongho.com),03/04/2024,Nhân viên,,Không yêu cầu,Không yeu cau,Quận Phú nhuận,NHÂN VIÊN BÁN HÀNG,CV2024-26880
GIA ĐÌNH CÔ NGUYỄN THỊ HẢO,05/04/2024,Nhân viên,,Không yêu cầu,Không yeu cau,Quận Gò Vấp,GIÚP VIỆC NHÀ CHĂM TRẺ BAO ĂN Ở (CTV),CV2023-26828
Công ty TNHH Sản Xuất Bao Bì Dương Vinh Hoa,08/04/2024,Nhân viên,,2,Không yeu cau,Quận Bình Tân,NHÂN VIÊN TÀI XẾ,CV2024-26905
CÔNG TY CỔ PHẦN TRUYỀN THÔNG VÀ ĐẦU TƯ THƯƠNG MẠI ĐẠI DƯƠNG,08/04/2024,Nhân viên,,2,Không yeu cau,Quận Bình Thạnh,NHÂN VIÊN KINH DOANH,CV2021-26070
CÔNG TY CỔ PHẦN ĐẦU TƯ ASIA DRAGON,08/04/2024,Nhân viên,,Không yêu cầu,Không yeu cau,Quận Bình Tân,NHÂN VIÊN ĐỨNG MÁY - LAO ĐỘNG PHỔ THÔNG,CV2024-26890
KHÁCH SẠN VŨ GIA,09/04/2024,Nhân viên,,Không yêu cầu,Không yeu cau,Quận 1,LỄ TÂN / TẠP VỤ / BẢO VỆ,CV2024-26886
CÔNG TY TNHH NGHIÊN CỨU VÀ PHÁT TRIỂN GIA VỊ THỰC PHẨM VIỆT,09/04/2024,Nhân viên,,Không yêu cầu,Không yeu cau,Quận Gò Vấp,CÔNG NHÂN SẢN XUẤT,CV2024-26907
CÔNG TY TNHH TMDV CÔNG NGHỆ PHÚC ĐẠT,19/04/2024,Nhân viên,,Không yêu cầu,Không yeu cau,Quận Gò Vấp,NHÂN VIÊN KHO HÀNG (1T),CV2024-26913
CÔNG TY TNHH VẬN TẢI DƯƠNG HUY,11/04/2024,Nhân viên,,Không yêu cầu,Không yeu cau,Quận 12,KHO + BỐC XẾP (CTV BAO Ở),CV2024-26909
QÙA TẶNG ĐỐI TÁC – ĐỒ CHƠI SÁNG TẠO IDEASHOP,09/04/2024,Nhân viên,,Không yêu cầu,Không yeu cau,Quận 1,NHÂN VIÊN BÁN HÀNG,CV2024-26908
NHÀ HÀNG ẤN ĐỘ TANDOOR,11/04/2024,Nhân viên,,Không yêu cầu,Không yeu cau,Quận 1,NHÂN VIÊN PHỤ BẾP ( NAM),CV2024-26910
CÔNG TY TNHH DỊCH VỤ VẬN TẢI VÀ ĐÀO TẠO LÁI XE THÁI VINH,19/04/2024,Nhân viên,,1,Không yeu cau,Quận Bình Thạnh,KINH DOANH (1T),CV2024-26914
CÔNG TY TNHH SAO MẶT TRỜI QUỐC TẾ,19/04/2024,Nhân viên,,Không yêu cầu,Không yeu cau,Quận 1,NHÂN VIÊN KINH DOANH,CV2024-26915
CÔNG TY TNHH TMDV CÔNG NGHỆ PHÚC ĐẠT,19/04/2024,Nhân viên,,1,Không yeu cau,Quận Gò Vấp,KẾ TOÁN (1T),CV2024-26912
PHỞ SUNG,23/04/2024,Nhân viên,,Không yêu cầu,Không yeu cau,Quận 7,QUẢN LÝ NHÀ HÀNG/ĐẦU BẾP/PHỤ BẾP/TẠP VỤ/THÂU NGÂN,CV2024-26919
Công ty TNHH MTV Mắt Kính Mắt Sài Gòn,24/04/2024,Nhân viên,,1,Không yeu cau,Quận 10,NHÂN VIÊN KINH DOANH,CV2023-26740
TIỆM VÀNG KIM PHÁT,25/04/2024,Nhân viên,,Không yêu cầu,Không yeu cau,Quận Bình Thạnh,NHÂN VIÊN BÁN HÀNG (BAO Ở),CV2024-26917
CÔNG TY TNHH LỰC HỒNG,05/06/2024,Nhân viên,,Không yêu cầu,Không yeu cau,"Quận 12, Quận Gò Vấp",LAO ĐỘNG PHỔ THÔNG LẮP RÁP THIẾT BỊ BĂNG TẢI,CV2024-26952
Công Ty TNHH HELIOS Industries,08/06/2024,Nhân viên,,1,Không yeu cau,Quận Phú nhuận,KỸ SƯ XÂY DỰNG,CV2022-26502
CÔNG TY CỔ PHẦN GIAO HÀNG TIẾT KIỆM,10/06/2024,Nhân viên,,Không yêu cầu,Không yeu cau,Quận Tân Bình,NHÂN VIÊN GIAO HÀNG (shipper ) VÀ TÀI XẾ XE TẢI.,CV2024-26954
TRƯỜNG ĐOÀN LÝ TỰ TRỌNG,10/06/2024,Nhân viên,,1,Không yeu cau,Quận Thủ Đức,NHÂN VIÊN PHÒNG ĐÀO TẠO,CV2024-26956
TRƯỜNG ĐOÀN LÝ TỰ TRỌNG,10/06/2024,Nhân viên,,Không yêu cầu,Không yeu cau,Quận Thủ Đức,NHÂN VIÊN PHÒNG HỢP TÁC PHÁT TRIỂN,CV2024-26957
TRƯỜNG ĐOÀN LÝ TỰ TRỌNG,10/06/2024,Nhân viên,,Không yêu cầu,Không yeu cau,Quận Thủ Đức,NHÂN VIÊN PHÒNG HÀNH CHÁNH TỔ CHỨC,CV2024-26958
TRƯỜNG ĐOÀN LÝ TỰ TRỌNG,10/06/2024,Nhân viên,,Không yêu cầu,Không yeu cau,Quận Thủ Đức,GIÁO VIÊN,CV2024-26959
CÔNG TY TNHH KOUPLE,12/06/2024,Nhân viên,,Không yêu cầu,Không yeu cau,Quận 7,NHÂN VIÊN PHỤC VỤ,CV2024-26961
CTY TNHH CÔNG NGHIỆP THỰC PHẨM LIWAYWAY SÀI GÒN_Oishi,14/06/2024,Nhân viên,,Không yêu cầu,Không yeu cau,Quận 4,NHÂN VIÊN GIAO HÀNG TẠI TP.HCM,CV2024-26941
CÔNG TY TNHH CẤP NƯỚC TÓC TIÊN,04/07/2024,Nhân viên,,Không yêu cầu,Không yeu cau,Bà Rịa - Vũng Tàu,KỸ SƯ XÂY DỰNG (NGÀNH CẤP NƯỚC),CV2024-26966
CÔNG TY TNHH SUẤT ĂN CÔNG NGHIỆP HẢI YẾN,11/07/2024,Nhân viên,,Không yêu cầu,Không yeu cau,Quận 7,NHÂN VIÊN PHỤC VỤ BẾP,CV2024-26968
HỆ THỐNG GIÁO DỤC ATY,12/07/2024,Nhân viên,,1,Không yeu cau,"Quận 12, Quận Tân Phú",QUẢN LÝ KÝ TÚC XÁ,CV2024-26969
TRUNG TÂM PHÁT TRIỂN NHÂN LỰC HITECO,15/07/2024,Nhân viên,,Không yêu cầu,Không yeu cau,Quận Tân Bình,TƯ VẤN VIÊN / THỰC TẬP SINH TẠI NHẬT,CV2024-26971
Cty TNHH TM – DV – TV  HIỆP THÀNH TÍN,17/07/2024,Nhân viên,,Không yêu cầu,Không yeu cau,Quận 1,NHÂN VIÊN BẢO VỆ,CV2024-26973
HAIR SALON BOBO,23/07/2024,Nhân viên,,Không yêu cầu,Không yeu cau,Quận 1,THỢ LÀM TÓC / LỄ TÂN,CV2024-26980
Tư Nhân Nguyễn Thị Ánh,26/07/2024,Nhân viên,,Không yêu cầu,Không yeu cau,Quận 7,Giúp Việc Nhà ( Bao ăn ở ),CV2024-26981
GIA ĐÌNH CHỊ NGUYỄN THỊ THIÊN HƯƠNG,29/07/2024,Nhân viên,,Không yêu cầu,Không yeu cau,Quận Gò Vấp,GIÚP VIỆC NHÀ THEO GIỜ,CV2024-26977
TRUNG TÂM GIÁO DỤC NGHỀ NGHIỆP GIÁO DỤC THƯỜNG XUYÊN QUẬN 1,02/08/2024,Nhân viên,,Không yêu cầu,Không yeu cau,"Quận 1, Quận 12, Quận Tân Phú",BẢO VỆ / QUẢN LÝ KÝ TÚC XÁ / GIÁO VIÊN,CV2024-26984
QUÁN CƠM ANH VŨ,03/05/2024,Nhân viên,,Không yêu cầu,Không yeu cau,Quận 1,TẠP VỤ,CV2024-26925
TRUNG TÂM THANH THIẾU NIÊN MIỀN NAM,07/05/2024,Nhân viên,,Không yêu cầu,Không yeu cau,Quận 3,BẢO VỆ,CV2024-26927
CTY TNHH TMDV SẢN XUẤT SOMICO,07/05/2024,Nhân viên,,Không yêu cầu,Không yeu cau,Quận Gò Vấp,QUẢN LÝ KHO/ CÔNG NHÂN ĐÓNG HÀNG,CV2024-26929
CÔNG TY TNHH THIÊN PHÚC,03/05/2024,Nhân viên,,Không yêu cầu,Không yeu cau,Quận 3,NHÂN VIÊN KINH DOANH,CV2024-26926
NHÀ VĂN HÓA THANH NIÊN THÀNH PHỐ,17/05/2024,Nhân viên,,Không yêu cầu,Không yeu cau,Quận 1,TẠP VỤ,CV2021-26029
CTY TNHH CÔNG NGHIỆP THỰC PHẨM LIWAYWAY SÀI GÒN_Oishi,17/05/2024,Nhân viên,,Không yêu cầu,Không yeu cau,H.Thuận An,CÔNG NHÂN (Phụ xe giao hàng),CV2024-26938
QUÁN ỐC NY,17/05/2024,Nhân viên,,Không yêu cầu,Không yeu cau,Quận Tân Bình,PHỤC VỤ (bao ăn ở),CV2024-26936
CTY TNHH CÔNG NGHIỆP THỰC PHẨM LIWAYWAY SÀI GÒN_Oishi,17/05/2024,Nhân viên,,Không yêu cầu,Không yeu cau,Quận 4,NHÂN VIÊN BÁN HÀNG (Bộ phận marketing),CV2024-26940
KHÁCH SẠN BÌNH MINH LÊ LAI,17/05/2024,Nhân viên,,Không yêu cầu,Không yeu cau,Quận 1,PHỤC VỤ (Part time)/ BẢO VỀ/ TIẾP TÂN,CV2024-26933
BIDA QUEEN,17/05/2024,Nhân viên,,Không yêu cầu,Không yeu cau,Quận 1,ĐẦU BẾP CHẢO,CV2024-26932
CTY TNHH CÔNG NGHIỆP THỰC PHẨM LIWAYWAY SÀI GÒN_Oishi,18/05/2024,Nhân viên,,Không yêu cầu,Không yeu cau,Quận Tân Bình,NHÂN VIÊN HỖ TRỢ KINH DOANH,CV2024-26942
CTY TNHH CÔNG NGHIỆP THỰC PHẨM LIWAYWAY SÀI GÒN_Oishi,18/05/2024,Nhân viên,,1,Không yeu cau,Quận Tân Bình,NHÂN VIÊN KINH DOANH HIỆN ĐẠI,CV2024-26937
VPĐD CÔNG TY CỔ PHẦN MISA tại TP. Hồ Chí Minh,20/05/2024,Nhân viên,,Không yêu cầu,Không yeu cau,Quận 12,NHÂN VIÊN KINH DOANH PHẦN MỀM,CV2024-26944
KHÁCH SẠN VŨ GIA,20/05/2024,Nhân viên,,Không yêu cầu,Không yeu cau,Quận 1,NHÂN VIÊN BẢO VỆ/ LỄ TÂN/ TẠP VỤ,CV2024-26861
NHÀ HÀNG NHẬT BẢN HOA TUYẾT,22/05/2024,Nhân viên,,Không yêu cầu,Không yeu cau,Quận 1,TẠP VỤ,CV2024-26883
CÔNG TY CP VIỄN THÔNG ACT,23/05/2024,Nhân viên,,Không yêu cầu,Không yeu cau,"Quận 1, Quận 2, Quận 3, Quận 4, Quận 5, Quận 6, Quận 7, Quận 8, Quận 9, Quận 10, Quận 11, Quận 12, Huyện Bình Chánh, Quận Bình Tân, Quận Bình Thạnh, Huyện Cần Giờ, Huyện Củ Chi, Quận Gò Vấp, Huyện Hóc Môn, Huyện Nhà Bè, Quận Phú nhuận, Quận Tân Bình, Quận Tân Phú, Quận Thủ Đức",KTV NHÀ TRẠM/ KTV LẮP ĐẶT INTERNET,CV2024-26943
CT ĐT TÀI CHÍNH NHÀ NƯỚC TP. HỒ CHÍ MINH,27/05/2024,Nhân viên,,Không yêu cầu,Không yeu cau,Quận 1,CHUYÊN VIÊN QUẢN LÝ VÀ KINH DOANH VỐN,CV2024-26930
CÔNG TY TNHH XUẤT NHẬP KHẨU TÍN VĨ,29/05/2024,Nhân viên,,Không yêu cầu,Không yeu cau,Quận 4,KẾ TOÁN VIÊN,CV2024-26885
CÔNG TY TNHH SX THỰC PHẨM VIỆT NHI,30/05/2024,Nhân viên,,Không yêu cầu,Không yeu cau,Quận 6,NHÂN VIÊN VĂN PHÒNG,CV2024-26854
CÔNG TY TNHH THIẾT BỊ VĂN PHÒNG GIA THỊNH,06/08/2024,Nhân viên,,Không yêu cầu,Không yeu cau,Quận Gò Vấp,NHÂN VIÊN KỸ THUẬT,CV2024-26992
TỔNG CÔNG TY CỔ PHẦN NOVA SERVICE,14/08/2024,Nhân viên,,Không yêu cầu,Không yeu cau,Quận 1,CHUYÊN VIÊN KINH DOANH,CV2024-26993
CÔNG TY TNHH SƠN HÀ CT,16/08/2024,Nhân viên,,2,Không yeu cau,Quận Gò Vấp,NHÂN VIÊN KỸ THUẬT,CV2024-26998
QUÁN CƠM ANH VŨ,26/08/2024,Nhân viên,,Không yêu cầu,Không yeu cau,Quận 1,PHỤ QUÁN CƠM,CV2024-26999
KHÁNH BI CLUB,26/08/2024,Nhân viên,,Không yêu cầu,Không yeu cau,Quận 6,PHỤC VỤ QUÁN BIDA,CV2024-27002
